103.7697865,1.437671413,MARSILING PARK,"With Its Lush Greenery And Peaceful Ambience, Marsiling Park Is An Oasis Of Calm And Tranquillity. Formerly Known As Woodlands Town Garden, The Park Features Activity Areas And Amenities For Visitors Of All Ages.Visitors Can Enjoy The View Of The Picturesque Pond From The Viewing Tower Or The Boardwalks, Especially In The Evening, As The Lighting Is Curated To Leverage On The Reflections On The Water Body To Create A Special Illumination Effect.The One Of A Kind Butterfly-Shaped Playground With Climbing Ropes Provides Children With A Challenging Play Experience While The Fun Play Area Has Play Equipment With Musical Elements For An Interactive Play Experience.Nature-Lovers Will Appreciate The Butterfly-Attracting Plants And Educational Interpretive Boards That Have Been Introduced Around The Playground, As Well As The Enhanced Mangrove Habitat Along The Western Edge Of The Park.There Are Also Several Spaces For Community Activities, Such As The Activity Plaza And The Amphitheatre, Which Features A Rain Garden."
103.7893632,1.285028,Kent Ridge Park,"A Historical Park Where One Of The Last Battles For Singapore Was Fought During World War Ii, Kent Ridge Park Is A Great Place For Families And History Buffs To Learn About The Heritage Of Our Nation.Relive The History Of World War Ii At The “reflections Bukit Chandu” Museum, Located At One End Of Canopy Walk. Celebrate The End Of Civil Strife By Visiting The Commemoration Plaque At Carpark B, Which Was Erected To Mark The 50Th Anniversary Of The End Of World War Ii.If You Are A Fitness Enthusiast, Warm Up At One Of The 20 Fitness Stations Located Around The Park Before Going For A Jog On The Tracks.Featuring Natural Vegetation And A High Biodiversity Of Wildlife, Kent Ridge Park Is Also A Favourite Of Nature Lovers. On The Eastern Side Of The Park Towards The Valley Is A Natural Pond Teeming With Turtles And Fish. Walk Along Canopy Walk – An Elevated Boardwalk Measuring 280-Metres Long Linking Hortpark To Kent Ridge Park – And You May Just Be Able To Catch Sight Of Sunbirds, Doves, Squirrels, Lizards, And White-Crested Laughing Thrush.With Groves Of Tembusu, Adinandras And Dillenias, You’ll Hear The Chirps Of Birds And The Hums Of Insects As You Stroll Along The Meandering Paths Of The Park Towards The Two Ponds At The Foot Of The Ridge. Alternatively, Take In Magnificent Views Of Off-Shore Islands Such As Pulau Duran Darat From The Various Look-Out Points.Kent Ridge Park Is Part Of The Southern Ridges, Which Also Comprises Mount Faber Park, Telok Blangah Hill Park, Hortpark And Labrador Nature Reserve."
103.8416357,1.281608851,DUXTON PLAIN Park,"Duxton Plain Park Is Located Entrance Via New Bridge Road, Neil Road, Kreta Ayer Road And Yan Kit Road"
103.8465776,1.286639263,HONG LIM Park,"Hong Lim Park Is A Site For Storytelling And A Place That Tells Singapore’s Story. Of Historical And National Significance, The Park Was Originally Named After The First Superintendent Of Police, Thomas Dunman. But In 1876, The Park’s Name Was Changed To Hong Lim Green In Honour Of Cheang Hong Lim, A Wealthy Businessman Who Donated The Land, Making It Singapore'S First Privately-Owned Public Garden.Through Its History, The Park Has Served As An Important Recreational Area In Chinatown And Is Still The Venue Today For Many Community Events. It Started Its Storytelling Tradition During The Japanese Occupation. In The 1950S And 1960S, It Was Used As A Cricket Ground By Members Of The Singapore Chinese Recreation Club And The Singapore Cricket Club, And In The 1960S And 1970S, The Storytelling Resumed In Another Medium As Chinese Operas Were Performed On The Stage. The Park Also Served As The Venue Of Many Of Singapore’s First Political Rallies.In September 2000, In Recognition Of The Park’s Storytelling And Political Legacy, The Singapore Government Designated The Park As The Venue For Speakers' Corner."
103.8799165,1.329461219,ALJUNIED Park,Aljunied Park Is Located Along Aljunied Road Within Happy Garden Estate
103.8429487,1.374167606,ANG MO KIO TOWN GARDEN WEST,"Built On A Hillock With Lush And Spreading Greenery, Ang Mo Kio Town Garden West Is A Great Place For Nature Lovers And Fitness Enthusiasts Alike.Recreational Runners Looking For A Challenge Can Jog On The Many Footpaths Meandering Through The Forest And Flowing Over The Hilly Terrain. Nature Lovers Can Enjoy The Secondary Forest Which Has Plants Such As Dillenia And Vitex Growing Plentiful. Visitors Can Also Climb A 120-Step Staircase To The Plaza Area To Enjoy A Bird’s Eye View Of Ang Mo Kio Town Garden West."
103.8246954,1.287384021,TIONG BAHRU Park,"Developed In 1967, Tiong Bahru Park Is A Haven Of Tranquillity For The Nearby Residents Of Henderson, Bukit Merah And Lower Delta Road. With The Theme ‘old Frame, New Images”, The Park Blends Its Existing Structure With New Facilities To Provide A Livelier Ambience And To Cater To Different Groups Of Park Users.Fitness Enthusiasts Can Warm Up At The Various Fitness Corners And Exercise Stations Before Jogging Around The Park. Alternatively, Walk On The Foot Reflexology Footpath For A Relaxing Foot Massage. Visitors Can Also Sit On The Benches And Relax In The Cool Shade Of The Many Trees Dotting The Park."
103.8324134,1.371097378,SHANGRI-LA PLAYGROUND,Shangri-La Playground Is Located Junction Of Ang Mo Kio Ave 2 And Jalan Lanjut
103.8298299,1.37348773,GELENGGANG PARK,Gelenggang Park Is Located Upper Thomson Road Behind Esso Station.  Junction Of Jalan Kuras/Jalan Gelenggang
103.8819255,1.332919392,MACPHERSON LINEAR Park,"Macpherson Linear Park Is Located A Linear Park Between Blk 20, Joo Seng Road And Macpherson Road In Macpherson Garden Estate. Also A Transitional Zone For Commuters In Industrial Areas And For Transport Purposes."
104.0025712,1.381131307,CHANGI BEACH Park,"One Of The Oldest Coastal Parks In Singapore, Changi Beach Park Still Retains A Kampong Ambience. With Stretches Of Pristine White Beaches Dotted With Coconut Palms, Bbq Pits, Park Benches And Shelters, The Park Is A Great Place For Families To Gather For Swimming, Picnics And Barbeques.Fitness Enthusiasts Can Jog And Cycle Along The Winding Tracks. Alternatively, Experience Seafront Dining At A Bistro In The Park Or At The Nearby Changi Village And Enjoy The Gentle Sea Breeze And The Sound Of Rolling Waves As You Dine.Approximately 3.3Km Long, Changi Beach Park Stretches From Changi Point To Changi Ferry Terminal And Overlooks Pulau Ubin.Get Connected From Changi Beach Park To Rower’s Bay Park, Pasir Ris Park, Sengkang Riverside Park, East Coast Park And Other Park Connectors Via The Round Island Route! Clickhereto Read More."
103.8519569,1.286823908,EMPRESS PLACE,"Empress Place Is Significant For Its Historicity, As It Is Cited Along The Singapore River And Near To The Supposed Landing Site Of Sir Stamford Raffles, The Founder Of Modern Singapore. He Was Believed To Have Landed At What Is Now Known As ‘raffles Landing Site’, Around The Corner Of The Asian Civilisation Museum. Located There Now Is The Iconic White Statue Of Sir Stamford Raffles Along The Singapore River.The Greens Of Empress Place Front The Old Empress Place Building, Currently The Second Wing Of The Asian Civilisation Museum. The Sir Stamford Raffles Bronze Statue And Dalhousie Obelisk Are Two Key Historical Monuments In The Area, Among Other Sculptures And Artwork By Artist Partners.When The Civic District Was Redeveloped In 2014, Eight Rain Trees (Samanea Saman), Were Affected By The Re-Alignment Of Fullerton Road. As Part Of The Conservation Efforts, These Eight Trees Were Transplanted Along The Periphery Of The New Lawn."
103.794116,1.282462167,PASIR PANJANG NURSERY,No Description Found For Pasir Panjang Nursery
103.8842745,1.340452869,BUNGA RAMPAI Park,"Bunga Rampai Park Is Located Located Along Jalan Bunga Rampai (Road) Is A Transitional Zone Among Bartley Mrt, Bartley Secondary School And Jalan Bunga Rampai Estate"
103.9313778,1.315870054,TANAH PUTEH Park,Tanah Puteh Park Is Located Jalan Tanah Puteh
103.9789854,1.389940082,TURNHOUSE Park,Turnhouse Park Is Located Natheravon Road
103.707922,1.338110796,Jurong Central Park,"As The First Park In Singapore To Have Life-Sized Board Game Features, Jurong Central Park Offers Families Countless Hours Of Fun And Excitement. Using Greenery, Sculpted Terrains, Various Play Equipment And A Dice Tower, The Park Recreates Favourite Childhood Board Games To Add A New Dimension To The Game Play Experience.With The Life-Sized Snakes And Ladders Playground And Ludo Garden, The Park Allows Visitors To Revisit Their Childhood And Relive Their Favourite Memories. Nature Lovers Can Also Explore And Discover The Various Types Of Aquatic Plants, Wildlife Species And Dragonflies That Thrive In The Ponds Located In The Park.Jurong Central Park Is Situated Across Boon Lay Mrt Station And Next To Jurongsafraclubhouse.It Is Connected To Jurong Lake Gardens Via The Jurong Park Connector, And To Yunnan Park Via The Jurong West Park Connector."
103.8737999,1.399016191,LORONG TANGGAM Park,Lorong Tanggam Park Is Located Lorong Tanggam
103.8476818,1.292516288,FORT CANNING PARK,"Festival At The Fort Is On From 26 August 2022 To 4 September 2022 - Find Out Morehere.Fort Canning Park, An Iconic Hilltop Landmark Has Witnessed Many Of Singapore’s Historical Milestones. The Hill Once Sited The Palaces Of 14Th Century Kings And Served As The Headquarters Of The Far East Command Centre And British Army Barracks. The Decision To Surrender Singapore To The Japanese On 15 February 1942 Was Also Made On The Hill, In The Underground Far East Command Centre, Commonly Known As Battle Box.Today, Fort Canning Park Features Nine Historical Gardens - The Pancur Larangan, Artisan’s Garden, Sang Nila Utama Garden, Jubilee Park (Phase 1), Raffles Garden, First Botanic Garden, Farquhar Garden, Spice Garden And Armenian Street Park.Click Here To Join Us For A Virtual Tour Aroundfort Canning Park | An Nparks Virtual Tour.To Get To Fort Canning Park, Visitors Can Make Use Of The Covered Escalators From Fort Canning Mrt Station And Bras Basah Mrt Station To The Top Of Fort Canning Park.Fort Canning Park Is A Venue For Celebrations. Its Expansive, Sprawling Lawns Play Host To Concerts, Theatre Productions And Festivals Such As Shakespeare In The Park, Ballet Under The Stars, Shakespeare In The Park And Films At The Fort, While Weddings, Parties And Gatherings Are A Regular Sight In The Park'S Venue Spaces. Its Ancient Artefacts Are A Must-See For History Buffs, And Its Lush Greenery And Expansive Lawns Offer A Variety Of Arts, Heritage And Nature Experiences. Whether You Are Drawn By The Park’s Ancient Artefacts And Rich Heritage Or Simply Its Tranquility, This Hilltop Park Offers Something For The Whole Family.View Herefor The Map Of Fort Canning Park.Click Hereto Sign Up As A Volunteer With Fort Canning Park."
103.8105451,1.278845363,Telok Blangah Hill Park,"Indulge In The Beauty Of The Secondary Forests At The Fringes Of Telok Blangah Hill Park By Trekking The Forest Walk – A 1.3-Kilometre-Long Elevated Walkway That Links Hortpark To Telok Blangah Hill Park, Or Get Up Close And Personal With The Forest Understory Vegetation By Heading Through Earth Trail. Complete Your Visit To Telok Blangah Hill Park By Crossing The Henderson Waves To Mount Faber Park. This 274M Long Structure Is The Highest Pedestrian Bridge In Singapore, And Is Frequently Visited For Its Artistic, Distinctive Wave-Like Structure Consisting Of A Series Of Undulating Curved 'Ribs'."
103.8184345,1.275116115,Mount Faber Park,"One Of The Oldest Parks In Singapore, Mount Faber Park Is A Popular Tourist Destination, Offering Visitors A Host Of Activities.Take A Cable Car From Mount Faber To Sentosa Island And Enjoy The Stunning View Of The Horizon From Above. Alternatively, You Can Gaze Through The Telescopes At One Of The Many Lookout Points That Are Situated At Various Sides Of The Ridge For A Panoramic View Of The Southern Part Of Singapore And The Southern Islands. Delve Into Our Nation’s Natural Heritage At Faber Point, The Highest Point In The Park, Where A Mural Wall Depicts Scenes Of Local Historical Events, And Where The Tree That Was Planted During The First Tree Planting Day Stands.Mount Faber Is Covered By A Secondary Rain Forest. The Vegetation On The Slope Helps To Stabilise The Terrain Besides Beautifying The Park.The Park Is Part Of The Southern Ridges, Which Also Comprises Telok Blangah Hill Park, Hortpark, Kent Ridge Park And Labrador Nature Reserve."
103.8343585,1.354287298,THOMSON Park,Thomson Park Is Located Along Jalan Sembilang Road
103.7791194,1.449488582,ADMIRALTY Park,"Located In Woodlands, Admiralty Park Is The Largest Park In The North. It Is Situated On Hilly Terrain With Sungei Cina River Running Through It, And Houses The Largest Nature Area Within An Urban Park.The Enhanced 7-Ha Urban Area Now Features 26 Slides. The Playground Capitalises On The Undulating Terrain To Site The Three Main Play Areas – Junior Play, Adventure Play And The Family Terracing Play – Catering To Children Of All Ages And Featuring Diverse Play Equipment That Encourage Group And Multi-Generation Interactions.Admiralty Park Also Features An Inclusive Playground, As Part Of An Initiative Announced By Nparks In 2015.  Inclusive Playgrounds Provide The Physical Structure, Or ‘hardware’, That Supports Play Between Children With And Without Special Needs.The 20-Ha Nature Area Encompasses A Diverse Mix Of Secondary Forest, Mangrove, Riverine And Open Grassland Habitats, And Is Home To More Than 100 Species Of Flora And Fauna. With Several Trails Within The 20-Hectare Nature Area, Visitors Can Discover The Different Species Living In The Forest, Spot Hordes Of Dragonflies And Observe Monkeys In Their Natural Habitat. Alternatively, Emerge From The Secondary Forest Near The Car Park And Admire The Butterflies And Different Species Of Birds As You Walk Through The Grassland. The Walking Trail Also Showcases Interesting Flora Like The Putat Kampung Tree And Climbers Like Hedgehog Rattan, An Increasingly Rare Plant In Singapore."
103.8400618,1.427827732,YISHUN POND Park,"Yishun Pond Park Is A Haven Of Tranquillity For Nearby Residents. Featuring A Pond Surrounded By Colourful Plants And A Variety Of Trees, Shrubs And Marshland Plants As Well As Several Bird Species, The Park Is A Great Place For Visitors To Get Close To Nature.Nature Lovers Can Also Learn More About The Flora And Fauna From Information Boards And Climb The Spiral Tower To Enjoy A Bird’s Eye View Of The Surrounding Areas. Alternatively, Sit And Relax At The Benches And Enjoy The Tranquillity And Beauty Of The Water Promenade.The Park Is Located Just Next To Khoo Teck Puat Hospital."
103.6929167,1.337519379,Yunnan Park,Yunnan Park Is Located Yunnan Crescent.Opp Jurong West Sports Hall.
103.8548235,1.292836686,WAR MEMORIAL Park,"War Memorial Park Sits On A Piece Of Land That Former Prime Minister Lee Kuan Yew Set Aside For The Building Of A Memorial In Remembrance Of All Civilian Victims Who Had Perished In World War Ii.Officially Unveiled In 1967, The War Memorial, Also Fondly Referred To As ""The Chopsticks"", Is A 61-Metre-Tall Memorial Comprising Four Columns To Represent Each Of The Four Races, Joined At The Base To Signify The Unity Of All Races.Memorial Services Are Held Annually At The Park On 15 February."
103.8536627,1.289487829,ESPLANADE Park,"Built In 1943, Esplanade Park Is One Of The Oldest Among Singapore's Heritage Parks. Redeveloped In 1991 To Enhance The Civic District'S Identity And To Create An Important Frontage For The Padang, Supreme Court And City Hall, Esplanade Park Is A Showcase For Many Of Singapore’s Historical Landmarks.Take A Stroll Through This Iconic Park And Reflect On The Sacrifices Made By Brave Soldiers At The Lim Bo Seng Memorial And The Cenotaph, And Marvel At The Intricacies Of The Victorian Splendour Of The Distinctive Blue And White Tan Kim Seng Fountain, Built In 1882 To Commemorate The Contributions To Singapore Of The Famous Chinese Philanthropist."
103.82695,1.439293276,KEMUNING Park,No Description Found For Kemuning Park
103.860432,1.288953356,YOUTH OLYMPIC Park,"Youth Olympic Park Is Singapore'S First Art Park And Was Developed To Foster A Greater Sense Of Community Ownership And Connection With Marina Bay. Opened On 24 April 2010, It Currently Features Art Installations Using Different Media By Local Youths, Depicting Life'S Aspirations. The Park Was Built And Named In Commemoration Of The Inaugural Youth Olympic Games Hosted By Singapore In August 2010."
103.7609353,1.360395537,Lorong Kemunchup Playground,Lorong Kemunchup Playground Is Located Along Lorong Kemunchup
103.9223487,1.334399333,BEDOK TOWN Park,"With Long, Flat And Linear Cycling And Jogging Tracks And A Myriad Of Fitness Equipment, Bedok Town Park Is A Popular Place For Nearby Residents To Gather For Recreational Activities.Built On An Undulating Terrain With High Mounds, The Park Offers Avid Cyclists And Runners A Challenging Workout. Those Looking To Relax Can Walk On The Foot Reflexology Footpath And Have A Foot Massage. Families Can Also Picnic Under The Shade Of The Many Trees Found Around The Park, While Enjoying The Tranquillity Of The Park."
103.7473879,1.387072049,CHOA CHU KANG Park,"Located In The North-Western Part Of Singapore, Choa Chu Kang Park Is Brimming With Recreational Activities For The Whole Family. With Four Different Areas, A Small Skate Plaza, A Wide Range Of Fitness Stations For The Young And Old, Lawns And Event Spaces, There’s Something For Everyone.Choa Chu Kang Still Retains Its History As A Rural Area Where Kampong Villages And Crop Plantations Flourish. Its Name “kangchu” Is A Reference To The Early Chinese Immigrants Who Settled Along Sungei Berih, And “chu” Is The Name Of An Established Clan. Today, Nature Lovers Can Walk Among The Remnants Of The Old Fruit Tree Plantations And Explore The Nature Areas Of The Park, Which Even Includes A Small Stream. Home To An Array Of Birds, The Park Is Also A Great Place For Bird Lovers To Enjoy The Symphony Of Chirps In The Early Mornings And Evenings. Families And Friends Can Bond Over Meals At The Restaurant Located In The Park."
103.8620024,1.348567822,CHILTERN DR INTERIM Park,No Description Found For Chiltern Dr Interim Park
103.820935,1.405746786,SPRINGSIDE Park,Springside Park Is Located Can Be Seen From The Main Road
103.9142984,1.3153688,TELOK KURAU Park,"Telok Kurau Park Is Located A Green Space Along Bedok Reservoir Pcn. Entrance Along Joo Chiat Place, Joo Chiat Walk, Joo Chiat Ave And Lorong J Telok Kurau (Road)"
103.8728813,1.398102868,JLN KAYU Park,No Description Found For Jln Kayu Park
103.9048151,1.410997214,PUNGGOL WATERWAY Park,"Built Around The Section Of Punggol Waterway And Located Along Sentul Crescent, Punggol Waterway Park Is A Great Place For Park Users To Enjoy A Fun-Filled Day Of Leisure Activities. The Park Is Segmented Into Four Different Themes: Nature Cove, Recreation Zone, Heritage Zone And Green Gallery.Fitness Enthusiasts Can Jog Or Cycle On The Well-Maintained Tracks Along The Promenade At Both Sides Of The Waterway While Admiring The Surrounding View. Alternatively, Sit On The Many Benches Placed Around The Park And Enjoy The Breeze As You Listen To The Soothing Sounds Of Running, Trickling, Splashing And Cascading Water. While Doing So, Look Out For The Various Types Of Birds That Can Be Spotted Along The Waterway.Punggol Waterway Park Is One Of Four Parks Linked By The North Eastern Riverine Loop Of The Park Connector Network. The Waterway Runs Through The Punggol Waterway Park, And Serves To Increase Park And Water Frontage For The Housing Estate While Providing A Green Respite For Residents.The Word ‘punggol’ In Malay Means 'Hurling Sticks At The Branches Of Fruit Trees To Bring Them Down To The Ground', A Reference To The Area’s History As A Fruit-Growing District Or As A Rendezvous For Wholesale Fruit Agents."
103.8448459,1.293374209,JUBILEE PARK (FCP),No Description Found For Jubilee Park (Fcp)
103.8457685,1.292109218,THE FOOTHILLS FORT CANNING Park,"The Foothills Fort Canning Park Is Located Along River Valley Road, Opposite Liang Court"
103.773043,1.343861304,Hoover Park (Lor Pisang Hijau Playground),No Description Found For Hoover Park (Lor Pisang Hijau Playground)
103.8340255,1.356562982,Jalan Sembilang Park,No Description Found For Jalan Sembilang Park
103.9892727,1.390140619,CHANGI POINT PROMENADE,Changi Point Promenade Is Located Near Lor Bekukong
103.9882843,1.390387048,CHANGI POINT WATERFRONT Park,Changi Point Waterfront Park Is Located Near Lor Bekukong
103.9873347,1.391188925,CHANGI PT FERRY TERMINAL,No Description Found For Changi Pt Ferry Terminal
103.9759334,1.390214723,CHANGI WEST BOARDWALK (CHANGI BC),No Description Found For Changi West Boardwalk (Changi Bc)
103.9838672,1.392231896,CHANGI EAST BOARDWALK (CHANGI FERRY TER),No Description Found For Changi East Boardwalk (Changi Ferry Ter)
103.8743881,1.340679962,BIDADARI Park,No Description Found For Bidadari Park
103.9058376,1.323199346,JLN ISMAIL Park,No Description Found For Jln Ismail Park
103.8220865,1.441158539,LEGUNDI Park,No Description Found For Legundi Park
103.907103,1.325851209,JLN DAUD Park,No Description Found For Jln Daud Park
103.9065035,1.325571855,JLN DAUD INTERIM Park,No Description Found For Jln Daud Interim Park
103.9058679,1.323882668,JLN AWANG INTERIM Park,No Description Found For Jln Awang Interim Park
103.9055272,1.321378162,JLN YASIN INTERIM Park,No Description Found For Jln Yasin Interim Park
103.9061031,1.320147427,LORONG SARINA INTERIM Park,Lorong Sarina Interim Park Is Located Along Jalan Eunos
103.7533138,1.368250241,Pavilion Playground II,No Description Found For Pavilion Playground Ii
103.8651136,1.326480954,ST MICHAEL's FC,No Description Found For St Michael'S Fc
103.9359637,1.317581115,SENNETT AVE LINEAR Park,No Description Found For Sennett Ave Linear Park
103.7956333,1.311672777,HOLLAND VILLAGE Park,"Located At The Junction Of Holland Road And Holland Avenue, Holland Village Park Is A Slice Of Peace And Tranquillity. Triangular In Shape And Gently Sloping, This 0.3-Hectare Park Provides Residents With A Brief Respite From The Hustle And Bustle Of The City.Visitors To The Park Can Sit Back And Relax Under The Shade Of The Existing Greenery, Which Includes Three Mature Rain Trees (Samanea Saman).Holland Village Park Is Adjacent To The Holland Village Mrt Station And Can Be Accessed Conveniently From The Five-Footway Of Shophouses."
103.8718041,1.379363984,ANG MO KIO LINEAR Park (PLOT 2),No Description Found For Ang Mo Kio Linear Park (Plot 2)
103.8687178,1.379242084,ANG MO KIO LINEAR Park (PLOT 3),No Description Found For Ang Mo Kio Linear Park (Plot 3)
103.8468456,1.313660983,CAMBRIDGE PARK,"Cambridge Park Is Located Junction Of Cambridge Road, Beside S’pore Baptist Church"
103.8230217,1.405591916,BROOK'S PARK,No Description Found For Brook'S Park
103.8725472,1.398773563,JLN KAYU INTERIM Park,No Description Found For Jln Kayu Interim Park
103.8194127,1.330371095,KHEAM HOCK PARK,Kheam Hock Park Is Located Along Kheam Hock Road
103.8995035,1.309727451,CEYLON ROAD INTERIM PARK,Ceylon Road Interim Park Is Located Along Dunman Road
103.8986769,1.310681707,HAIG WALK EXTENSION,Haig Walk Extension Is Located Along Dunman Road
103.9007194,1.310097045,ONAN ROAD GREEN SPACE,Onan Road Green Space Is Located Along Onan Road
103.8437904,1.276456448,TRAS LINK Park,No Description Found For Tras Link Park
103.767994,1.372414413,CASHEW RD INTERIM Park,No Description Found For Cashew Rd Interim Park
103.8272693,1.358642373,VENUS GREEN,"Venus Green Is Located Beside Venus Drive Carpark, Old Windsor Interim Park"
103.7552835,1.323879039,Faber Heights Park,No Description Found For Faber Heights Park
103.9071606,1.324405301,JALAN ISHAK PARK,No Description Found For Jalan Ishak Park
103.9078869,1.324040918,LORONG MARICAN PARK,No Description Found For Lorong Marican Park
103.90834,1.323797424,LORONG MARZUKI PARK,No Description Found For Lorong Marzuki Park
103.9092645,1.323993095,LORONG MELAYU PARK,No Description Found For Lorong Melayu Park
103.8465041,1.298183825,DHOBY GHAUT GREEN,"Dhoby Ghaut Green Was Officially Launched On 24 October 2009. It Was Identified As An Interim Park In Ura’s Public Space And Urban Waterfront Master Plan 2003 And Conceived As “city Room” For Community Gathering Within The City.The Sculptural Open-Air Amphitheatre Is A Landmark Of The Park, Serving As A Showpiece For The Architectural And Urban Design Excellence Demonstration Project And A Performance Venue To Encourage Public Participation And Enjoyment Of The Open Space.The Arts Centre Located Between Both Exits Of The Dhoby Ghaut Mrt Station Offers Exhibition Space For Local And International Artists, And Other Arts Recreational Activities For The Public."
103.8336274,1.214491316,SISTERS' ISLAND MARINE PARK,No Description Found For Sisters' Island Marine Park
103.8922988,1.310912069,GREEN LANE PARK,No Description Found For Green Lane Park
103.8620919,1.32743837,MAR THOMA ROAD PARK,No Description Found For Mar Thoma Road Park
103.859721,1.363426605,HAUS LINEAR PARK,Haus Linear Park Is Located Along Serangoon Garden Way.
103.7862098,1.338624504,SIAN TUAN INTERIM PARK,Sian Tuan Interim Park Is Located Along Sian Tuan Ave
