103.8226077,1.434309953,SEMBAWANG HOT SPRING PARK,"Located Off Gambas Avenue, Sembawang Hot Spring Park Features New Cascading Pools And A Water Collection Point, Enhanced Accessibility For Wheelchair Users, And Educational Panels Where Visitors Can Learn About Singapore’s Only Hot Spring Park’s History And Geology. The Park'S Rustic Environment, Reminiscent Of Old Kampungs, Also Holds Many Collective Memories For The Community.Visitors Can Enjoy The New Floral Walk And See Fruit Trees And Edible Plants Commonly Found In Kampungs, And Flowers Commonly Seen In The 1960S And 1990S. The Rustic Environment Is Further Enhanced By Unpaved Paths And Naturalised Streams Flowing From The Hot Spring, Which Mimics The Freshwater Swamp Forest Landscape. There Are Seating Areas Sheltered By Planted Trellises Featuring Flowering Creepers Such As The Elephant Climber (Argyreia Nervosa). The Public Can Also Learn More About The History Of The Site And Geothermal Processes Behind The Formation Of A Hot Spring Through Interpretative Signs At Locations Of Interest.Guidelines For Using The Hot Springlet'S Be Considerate Of Others When Enjoying The Facilities At Sembawang Hot Spring Park. View Theguidelines:Guidelines For Using The Hot Spring Footbathlet'S Be Considerate When Enjoying The Hot Spring Footbath At Sembawang Hot Spring Park. View Theguidelines:"
103.8788814,1.347891189,LORONG ONG LYE PARK,No Description Found For Lorong Ong Lye Park
103.9028344,1.311048078,KOON SENG PARK,"Koon Seng Park Is A Neighbourhood Park Located At The Junction Of Koon Seng Road And Tembeling Road. Facilities At This Park Include A Children’s Playground, 3G Fitness Equipment, A Basketball Court And A Dog Run."
103.8398482,1.462094169,IRAU DRIVE PLAYGROUND,No Description Found For Irau Drive Playground
103.8885723,1.332862751,PAYA LEBAR ROAD PARK,No Description Found For Paya Lebar Road Park
103.8752087,1.351627509,UPPER SERANGOON PARK,No Description Found For Upper Serangoon Park
103.7524398,1.367310121,Bukit Gombak Park,"Located On A Hill, The 4.8-Hectare Bukit Gombak Park Provides Surrounding Residents With Tranquil Areas To Enjoy Nature, Recreational Spaces For Families, And Opportunities For The Community To Experience Gardening And Be Closer To Nature.The Park Has Various Features That Cater To Different Groups Of Residents And Their Recreational Needs. For Families With Young Children, The Park Has A New Nature-Inspired Play Area. There Is Also An Outdoor Fitness Area With Exercise Equipment, An Open Lawn, And A Café. The Park Also Includes A 480Sqm Dog Run Featuring A Sloped Terrain For Dogs To Run Unleashed, And Benches For Dog Owners To Rest.Bukit Gombak Park Is A Node In The Bukit Batok Nature Corridor, Which Comprises More Than 125 Hectares Of Parks And 10Km Of Nature Ways And Park Connectors, Forming An Important Ecological Corridor Between The Central Nature Park Network And The Tengah Forest Corridor In Western Singapore."
103.8747789,1.35403956,BOUNDARY ROAD PARK,No Description Found For Boundary Road Park
103.819003,1.448723769,PARK AT SEMBAWANG ALLEY,No Description Found For Park At Sembawang Alley
103.8272027,1.443805848,JLN SENDUDOK PARK,No Description Found For Jln Sendudok Park
103.7274101,1.417252254,Native Plant Centre,No Description Found For Native Plant Centre
103.8580862,1.351753881,Chuan Lane Park,"Chuan Lane Park Is Located End Of Chuan Lane, Along Cte"
103.8782405,1.345374989,HOW SUN LINEAR PARK,No Description Found For How Sun Linear Park
103.90691,1.330953768,Jalan Singa Park,Jalan Singa Park Is Located Along Jln Singa Road And Bedok Reservoir Road
103.8018248,1.321936141,Victoria Park Playground,Victoria Park Playground Is Located Along Victoria Park Road
103.8478825,1.296415187,CANNING RISE (FCP),No Description Found For Canning Rise (Fcp)
103.8494947,1.294464155,ARMENIAN STREET (FCP),No Description Found For Armenian Street (Fcp)
103.8532799,1.289855009,CONNAUGHT DRIVE,No Description Found For Connaught Drive
103.8824581,1.343583163,UPPER PAYA LEBAR INTERIM PARK,No Description Found For Upper Paya Lebar Interim Park
103.8633381,1.378638507,Nim Meadow Park,No Description Found For Nim Meadow Park
103.7926556,1.330221185,MAPLE LANE PARK,"Maple Lane Park Is Located Along Maple Lane, Adjacent To Bukit Timah Rd"
103.7830327,1.327551249,HOLLAND GREEN LINEAR PARK,Holland Green Linear Park Is Located Along Holland Plain Road
103.8297474,1.283602195,Kim Pong Park,"Kim Pong Park Is Designed With A Simple And Clean Layout To Reflect The Art-Deco Era Of The Old Tiong Bahru Estate. The Pathways, Which Form A Circular Motif, Allow Visitors To Navigate Easily Through The Park. Catering To The Demographics Of The Estate, The Park Features Wide Pathways And Space Beside The Terrazzo Benches To Accommodate Wheelchairs And Prams.The Park Features Three Zones. The First And Largest Of The Three Zones Is An Open Field For Residents To Hold Group Activities. The Second Zone, Located In The Middle, Has Old-School Garden Swings To Further Highlight The Theme Of The Park. The Swings All Face Toward The Centre Of The Lawn To Promote Social Interaction. In The Third Zone, Which Is The Activity Zone, There Is A Pavilion With A Stage That Allows Residents To Take Shelter And Rest After Their Activities. The Pavilion Can Also Be Used For Community Events."
103.8737332,1.339399819,OLD UPPER ALJUNIED ROAD,No Description Found For Old Upper Aljunied Road
103.8692833,1.409355825,Hampstead Wetlands Park,"Developed By Jtc And Nparks, The 3.23 Hectare Hampstead Wetlands Park Is A Green Sanctuary And A Place For Rest And Recreation For The Surrounding Community Of Seletar Aerospace Park.This Park Provides A Conducive Environment For Plants, Birds And Other Wildlife That Inhabit Freshwater Ecosystems. Snags And The Habitat Islands Are Essential Parts Of The Wetland’s Ecology, Providing Birds And Other Wildlife With Shelter, Nesting Spots And Resting Grounds Away From Human Disturbances And Predators. The Habitat Islands Also Provide Additional Surface Area For Wetland Plants To Colonise. Wetlands Help To Remove Sediments From Surface Run-Off When It Rains, Thus Acting As A Natural Filter.As You Stroll Along The Scenic Boardwalk, Enjoy Nature Up Close At The Viewing Decks And Look Out For A Variety Of Interesting Flora And Fauna."
103.850477,1.370692186,ANG MO KIO TOWN GARDEN EAST,"Built On The Site Of A Former Rubber Estate, Ang Mo Kio Town Garden East Is Home To Rubber Trees As Well As Other Economically Important Trees Such As Nutmeg And Cinnamon. Tranquil And Peaceful, It Is A Popular Place For Nearby Residents To Conduct Recreational Activities.Fitness Enthusiasts Can Jog, Do Foot Reflexology Or Practice Tai Chi Among The Lush Greenery, While Enjoying The Open Space The Park Offers. Visitors Can Also Take A Slow Stroll Among The Groves Of Trees And View The Sculptures Of Rubber Seeds And Nutmegs Installed Around The Park."
103.8842362,1.399503155,SENGKANG RIVERSIDE Park,"With The Punggol Reservoir, Also Known As Sungei Punggol, Running Through It, Sengkang Riverside Park Is Calm And Tranquil. Featuring A Constructed Wetland And Rich Biodiversity, It Is A Favourite Of Nature Lovers.Visitors Can Hike On The Park’s Many Trails To View The Manually Planted Marshes And Get Close To The Inhabitants Of The Marshland. Home To Many Aquatic Plants, The Constructed Wetland Doubles Up As A Wildlife Habitat And Attracts A Variety Of Mangrove Birds And Damselflies. Alternatively, Embark On An Educational Journey To Explore The Fruit Trees Planted Around The Park. Besides Common Edible Fruits Such As Star Fruit, Chiku And Dragon Fruit, You May Even Discover Exotic Fruits That Cannot Be Found In Local Stalls And Supermarkets. Visitors Can Also Visit Singapore’s Largest Man-Made Wetland, Pub’s Sengkang Floating Wetland, Which Is Located Within The Park.Sengkang Riverside Park Is One Of Four Parks Located On The North Eastern Riverine Loop Of The Park Connector Network. Sengkang Riverside Park Was Awarded The Abc Waters Certification, As An Excellent Example Of How The Protection Of Our Water Resources Can Be Creatively Integrated With Urban Planning In A Sustainable Manner.Get Connected From Sengkang Riverside Park To Rower’s Bay, Pasir Ris Park, Changi Beach Park, East Coast Park And Other Park Connectors Via The Round Island Route! Clickhereto Read More."
103.8654823,1.370198575,TAVISTOCK AVE Park,No Description Found For Tavistock Ave Park
103.8841101,1.35554678,SURIN AVE NEIGHBOURHOOD Park,No Description Found For Surin Ave Neighbourhood Park
103.8351675,1.437741805,YISHUN NEIGHBOURHOOD Park,"Developed On An Old Rubber Estate, Yishun Neighbourhood Park Is The Place To Go To If You Are Looking For A Quiet Retreat. Featuring A Hill With An Open Lawn At The Top And Facilities Such As A Children’s Playground And Fitness Equipment, The Park Is A Great Place For Families Looking For A Day Of Fun.Fitness Enthusiasts Can Warm Up At The Exercise Stations Before Taking A Jog Around The Park. The Open Lawn At The Top Of The Hill Is Also Ideal For Picnics With Friends And Family."
103.7486825,1.317558696,Pandan Reservoir Fitness Corner,Pandan Reservoir Fitness Corner Is Located Juntion Of West Coast Road & Pandan Gardens
103.7907731,1.303053526,one-north Park,No Description Found For One-North Park
103.957842,1.313446086,EAST COAST PARK AREA G,No Description Found For East Coast Park Area G
103.9335984,1.306719376,EAST COAST PARK AREA E,No Description Found For East Coast Park Area E
103.886356,1.297184685,KATONG Park,Katong Park Is Located Junction Of Meyer Road & Fort Road
103.8996966,1.296657804,EAST COAST PARK AREA B,No Description Found For East Coast Park Area B
103.9691062,1.316006776,EAST COAST PARK AREA H,No Description Found For East Coast Park Area H
103.9247547,1.3043226,EAST COAST PARK AREA D,No Description Found For East Coast Park Area D
103.9078441,1.299278032,EAST COAST PARK AREA C,No Description Found For East Coast Park Area C
103.9431397,1.309735574,EAST COAST PARK AREA F,No Description Found For East Coast Park Area F
103.8725372,1.294437762,EAST COAST PARK AREA A,No Description Found For East Coast Park Area A
103.8477055,1.361114715,Bishan-Ang Mo Kio Park (River Plains),No Description Found For Bishan-Ang Mo Kio Park (River Plains)
103.7304799,1.335769135,JLG: CHINESE &amp; JAPANESE GARDEN,No Description Found For Jlg: Chinese &Amp; Japanese Garden
103.9226172,1.408830933,Coney Island Park,"Besides Being Rich In History, Coney Island Park Houses A Wide Variety Of Habitats, Including Coastal Forests, Grasslands, Mangroves, And Casuarina Woodlands. It Is Home To A Wide Variety Of Fauna And Flora, Some Of Which Are Critically Endangered. Some Plants At The Park Are Presumed Nationally Extinct In The Wild.Try Spotting One Of 80 Species Of Birds On Coney Island Park, Including The Resident Male Baya Weavers Weaving Their Large And Intricate Nests From Flowering Acacia Trees. Hear The Oriental Magpie-Robin’s Songs From The Forest, Or Follow The Flocks Of Parakeets Flying Through The Forest Canopies. The Different Habitats In The Park Allow For A High Diversity In Bird Species, Thus Making The Park An Ideal Location For Birdwatching. With Its Rich Biodiversity In A Rustic Setting, Coney Island Park Offers Much To Explore For Bird And Nature Enthusiasts.The Rustic Coney Island Park Is An Ecologically Sustainable Park With Many Environmental Initiatives. It Focuses On Conserving Energy And Water, Recycling And Retaining Of The Natural Elements In The Park. The Timber From Uprooted Casuarina Trees Were Collected And Recycled Into Park Signage, Seats, Benches, Boardwalk, And Exhibits At Casuarina Exploration.Start Exploring The Forest And Mangrove Habitats On The Newly Built Boardwalk And Move On To The Beach Which Can Be Accessed At Five Locations. You May Also Ride Through The Island Along The 2.5 Km Coney Island Park Connector, Taking In The Beautiful Promenade View Of The Serangoon Reservoir.Download The Park Map For More Information.Guided Walks At Coney Island Parkconducted By Nparks Volunteers, Participants Will Learn About The Diverse Biodiversity And Interesting History Of The Park. The Two-Hour Guided Walk Is Conducted On Selected Saturday Mornings In The Months Of June, November And December.Tips For Visiting Coney Island Parkthe Park Is Closed From 7Pm To 7Am.Terrain Is Rugged At Parts And May Be Unsuitable For Young Children And People With Mobility Issues.To Maintain The Park’s Rustic Character And Natural Habitats, There Is No Electricity Or Piped Water On The Island.Wear Long Pants And Covered Shoes For Protection From Insects Such As Sandflies.Keep To The Designated Trails And Refrain From Entering The Vegetated/ Forested Areas.Appreciate Any Animals From Afar. Clickhereto Find Out More.Do Not Eat Or Carry Plastic Bags In The Presence Of Macaques. Macaques May Have Been Conditioned To Associate Plastic Bags With Food, And Feeding Them Will Make Them Bold.Do Avoid Visiting The Park During A Storm, Or Seek Shelter Immediately If It Rains While You Are Within The Park.Remember To Take Only What You Have Brought In, And Leave Nothing Behind But Footprints.Please Note That Entry To The Haw Par Beach Villa Isstrictlynot Allowed."
103.8906279,1.367785631,REALTY PARK,Realty Park Is Located Along Hougang Ave 4
103.9407321,1.363742235,Tampines Boulevard Park,No Description Found For Tampines Boulevard Park
103.7269496,1.333663351,JLG: LAKESIDE GARDEN,No Description Found For Jlg: Lakeside Garden
103.7320008,1.341096726,JLG: CG MRT TOL Linkway,No Description Found For Jlg: Cg Mrt Tol Linkway
103.9215026,1.315426922,YARROW PARK,"Yarrow Park Is An Example Of A Successful 3P (Private-Public-People) Collaboration, Which Brought About A Common Space For The Community, Allowing Joo Chiat Residents Of All Ages To Enjoy Brand New Recreational Facilities.The Park Has Various Features That Cater To Different Groups Of Residents, Including An Exercise Equipment, A Sheltered Space/Seating Area For Park Goers, A Parent-Child Swing To Encourage Family Bonding, And A Composite Playset For The Younger Ones.With An Approximate Area Of 2,270 Sqm, The Park Is Complemented With Beautiful Greenery And Flora, Bringing Vibrancy To This Mature Private Estate."
103.8159584,1.314200281,SINGAPORE BOTANIC GARDENS,"Established In 1859, The Singapore Botanic Gardens Is A Star Visitor Attraction For The Sophisticated Traveller And The Local Resident. The Gardens Possess An Array Of Botanical And Horticultural Features With A Rich History And A Wonderful Plant Collection Of Worldwide Significance. Complementing These Unique Resources Are Sensitive Developments And Entertainment Events Providing Visitors Educational And Recreational Facilities Amidst The Wonders Of Nature. It Is A Unique Example Of The Informal English Landscape Movement’s Style In An Equatorial Climate.Brief Historythe First Botanical Garden Was Set Up By Sir Stamford Raffles, The Founder Of Singapore And A Keen Naturalist, In 1822 On Government Hill At Fort Canning, Mainly To Introduce Into Cultivation Economic Crops. It Closed In 1829 And, In 1859, At The Present Tanglin Site A New Garden Was Developed By An Agri-Horticultural Society, And Later Handed Over To The Government In 1874. From An Ornamental Garden With Roads, Terraces, A Band Parade Area And Even A Small Zoo At One Point, It Has Come A Long Way In Evolving Into An 82-Hectare Leading Botanic Garden Of Plant Research And Conservation In The Tropics.In June 2012, Singapore Ratified The World Heritage Convention And In December 2012, Submitted Its World Heritage Tentative List To Unesco To Indicate Interest In Inscribing The Singapore Botanic Gardens As A World Heritage Site.In January 2014, The Official Nomination Dossier For The Gardens Was Submitted To Unesco. In September 2014, A Technical Assessor From The International Council On Monuments And Sites (Icomos) Visited The Gardens As Part Of The Bid Evaluation Process.On 4 July 2015, The Gardens Received Inscription As A Unesco World Heritage Site At The 39Th Session Of The World Heritage Committee (Whc).Click Here To Find Out More.The Gardensthe Gardens Was Originally Developed Along A Three-Core Concept. The Three Cores Comprised Tanglin Which Is The Heritage Core Retaining The Old Favourites And Charms Of The Historic Gardens; Central, The Visitor Belt Of The Gardens; And Bukit Timah, The Educational And Discovery Zone. A Fourth Core, Tyersall-Gallop, Was Created With The Opening In 2017 Of The Learning Forest Which Is Designed To Integrate Into The Gardens' Existing Rainforest To Form An Enlarged Forest Habitat.Each Core Presents An Exciting Array Of Attractions. Take Your Time To Stroll Around The Gardens And Enjoy The Wonderful Sights, Sounds And Wonders The Luscious Greenery Offers.Visit Thesingapore Botanic Gardens Websiteto Find Out More About The Gardens And Its Various Features Including The Newly Opened Gallop Extension, Theethnobotany Garden, Keppel Discovery Wetlands And Sph Walk Of Giants At Thelearning Forest, Thenational Orchid Gardenandjacob Ballas Children'S Garden.The Jacob Ballas Children'S Garden Has Doubled In Size With A Two-Hectare Extension That Includes New Features Geared Towards Youngsters Up To 14 Years Old. The New Extension Allows Children To Experience And Learn About Different Eco-Systems In Four New Zones: Farm, Forest, Stream, And Orchard.The New One-Hectare Ethnobotany Garden Is The First In Singapore Where Visitors Can Learn About Plants Used By Indigenous Cultures Of Southeast Asia. The Garden Includes Acentre For Ethnobotanywhich Complements The Outdoor Landscape With An Interpretive Exhibition Of Artefacts And Interactive Elements.The First In Singapore, Theseed Bankexpands The Gardens’ Conservation Capacity In Safeguarding The Germplasm Of Threatened Plant Species In Southeast Asia. At The Same Time, Visitors Can Learn About The Importance Of Seed Storage For Species Conservation And Plant Biodiversity, Seed Dispersal And Germination Through Curated Programmes At An Interpretative Gallery And Outdoor Garden.Framed By Landscapes Composed Of Native Plants And Forests, Thegallop Extensioncontributes To The Gardens’ Rich Heritage And Its Role In Research, Conservation, Education And Recreation. As A Natural Extension Of The Gardens’ Nature Area, Which Covers The Rain Forest And The Learning Forest, The Gallop Extension Enables Visitors To Learn About Forest Ecology And The Significance Of Conservation."
103.8025397,1.26661219,Labrador Nature Reserve,"Advisory:Some Parts Of Labrador Nature Reserve, Including The Jetty, Will Be Closed From 1 March 2023 To Facilitate Slope Works. For More Information,Clickhere.Built On The Edge Of The Secondary Forest With A Prime Vantage Point Of The Cliff-Side Vegetation And A Picturesque View Of The Sea, Labrador Nature Reserve Is An Oasis Of Tranquillity And Natural Wonders. Thriving With Wildlife, The Park Is A Favourite Haunt Of Nature Lovers. It Is Not Uncommon For Visitors To Hear Songs From A Variety Of Bird Species, Including Those Of The Oriental Magpie-Robin And Black-Naped Oriole. Take A Leisurely Stroll Along One Of The Nature Trails, And You May Spot The Resident Squirrels Scurrying Up Trees.Labrador Nature Reserve Is Part Of The Southern Ridges, Which Also Comprises Mount Faber Park, Telok Blangah Hill Park, And Kent Ridge Park.Specifics Do'S And Don'Ts:-No Pets Are Allowed In The Nature Reserve. Please Refer To The Map & Trail Etiquette Below For More Information."
103.7780732,1.35443433,Bukit Timah Nature Reserve,"Experience Nature In Its Pristine Form At Bukit Timah Nature Reserve, Which Is A Mere 12 Km From The Bustling City Centre. By Virtue Of Singapore’s Location On The Equatorial Belt, The Reserve Has One Of The Richest And Most Diverse Ecological Systems. Visitors Will See An Astonishing Variety Of Plant, Animal And Insect Life, Typical Of A Humid Equatorial Climate.This 163-Ha Reserve Includes Singapore’s Highest Hill, Bukit Timah Hill, Which Stands At 163 M And Retains One Of The Few Areas Of Primary Rainforest In The Country. The Forest On The Hill Has Been A Botanical Collection Ground For More Than A Century, And The First Known Specimens Of Many Species Of Malayan Plants Have Been Obtained Here.Home To A High Percentage Of Our Nation’s (Native) Flora And Fauna, Bukit Timah Nature Reserve Has Been A Favourite Spot For Those Looking To Get Close To Nature. Some Of These Flora And Fauna Species Include The Seraya (Shorea Curtisii), Red Dhup (Parishia Insignis), Greater Racket-Tailed Drongo (Dicrurus Paradiseus) And Malayan Colugo (Galeopterus Variegatus).Established In 1883, Bukit Timah Forest Reserve Was One Of The First Forest Reserves To Be Created In Singapore, As Recommended By Nathaniel Cantley, The Then Superintendent Of The Singapore Botanic Gardens. In 1882, Cantley Was Commissioned By The Government Of The Straits Settlements To Prepare A Report On The Forests Of The Settlements. In His Report, He Recommended For Several Forest Reserves To Be Created On The Island, Which Were Established Over The Next Few Years.However, All The Reserves, Except For Bukit Timah Forest Reserve, Were Worked For Timber. By 1937, Most Of These Reserves Had Been Depleted Due To Economic Development. Thankfully, Bukit Timah Forest Reserve Was Retained For The Protection Of Its Flora And Fauna Under The Management Of The Singapore Botanic Gardens.In 1951, The Reserves Were Further Protected Through The Enactment Of A Nature Reserves Ordinance And The Establishment Of A Nature Reserves Board To Manage The Reserves.The Bukit Timah And Central Catchment Areas Were Later Declared As Nature Reserves In 1990. Today, The Nature Reserves Are Gazetted For The Propagation, Protection And Preservation Of Singapore’s Indigenous Flora And Fauna Under Theparks And Trees Act (Chapter 216).More About Bukit Timah Nature Reservethe Reserve Was Reopened In October 2016 Following The Completion Of Restoration Works Carried Out From September 2014 To October 2016. You Can Visit The Reserve And Journey Back In Time To The Days Before Sir Stamford Raffles Arrived As You Trek Among The Original Vegetation And Undisturbed Tropical Forest. Push Yourself To The Limits As You Climb Singapore’s Tallest Hill On Trails That Wind Through Pockets Of Hill Dipterocarp Forest, Not Found Anywhere Else On The Island.Learn About The Treasure Trove Of Native Biodiversity Within The Reserve Through Interactive Displays Of Forest Ecology And Plant Specimens At The Exhibition Hall, Located On The Second Floor Of The Visitor Centre.Bukit Timah Nature Reserve Was Officially Declared An Asean Heritage Park On 18 October 2011. Together Withsungei Buloh Wetland Reserve, It Is Now Part Of A Prestigious Regional Network Of 35 Protected Areas, Forming The Complete Spectrum Of Representative Ecosystems In Asean Member States."
103.8073563,1.400516498,Upper Seletar Reservoir Park,"Enter A World Filled With Lush Greenery And Rich History At The Upper Seletar Reservoir Park. With 15 Hectares Of Natural Vegetation, The Park Is Teeming With Flora And Fauna, Making It A Favourite Spot For Nature Lovers.Put On Your Running Gear And Go For A Heart-Pumping, Invigorating Jog Around The Park. Alternatively, Take A Leisurely Stroll And Admire The Serenity Of The Reservoir And The Majesty Of The Park’s Iconic Rocket-Shaped Tower. For The More Adventurous, Climb Up To The Top Of The Tower And Be Rewarded With Stunning Panoramic Views Of The Waters And Adjacent Greenery.Visitors Can Also Trek Along The Park’s Many Trails Or Go On A Nature Walk And Discover The Park’s Inhabitants. Nature Lovers Will Be Thrilled At The Sight Of The Resident Long-Tailed Macaques, But Are Cautioned Not To Expose Food Or Drinks In Their Presence As They Might Bite.The Seletar Reservoir Was Built In 1920 And Officially Opened By Her Royal Highness, Princess Alexandra, The Honourable Lady Ogilvy On 10 August 1969. In 1992, It Was Renamed As The Upper Seletar Reservoir And Became A Marked Historic Site In 1999.Today, The Upper Seletar Reservoir Is One Of The Four Reservoirs That Bound The Nature Reserves. The Other Reservoirs That Bound The Nature Reserves Are The Macritchie Reservoir, The Lower Peirce Reservoir, And The Upper Peirce Reservoir."
103.8126705,1.372209407,Upper Peirce Reservoir Park,"The Upper Peirce Reservoir Park Is A Serene And Tranquil Park Nestled Just Next To The Upper Peirce Reservoir. The Reservoir, Together With The Macritchie Reservoir, The Lower Peirce Reservoir And The Upper Seletar Reservoir, Bound The Central Catchment Nature Reserve. The Nature Reserve Acts As A Water Catchment For The Reservoirs In The Area.In The Late 1960S, Increasing Demand Of Water Led The Government To Examine The Feasibility Of Increasing The Capacity Of The Peirce Reservoir. A Higher Dam Was Then Constructed Upstream Of The Existing Dam In 1970. The Upper Peirce Reservoir Was Completed In 1975 And Officially Opened By Then Prime Minister Mr Lee Kuan Yew On 27 February 1977."
