103.8219667,1.382726119,Thomson Nature Park,"Located To The East Of The Central Catchment Nature Reserve (Ccnr), Between Old Upper Thomson Road And Upper Thomson Road, Thomson Nature Park Complements Existing Nature Parks Including Springleaf And Windsor Nature Parks To Extend The Green Buffer For The Ccnr. This 50-Hectare Buffer Park Is Unique For Its Rich Cultural Heritage As The Site Of A Former Hainan Village. It Is Also Home To A Rich Array Of Biodiversity And Is Notably A Key Conservation Site For The Critically Endangered Raffles’ Banded Langur (Presbytis Femoralis Femoralis).Explore The Five Trails Spanning 3.8 Km Around The Former Village'S Road Network. They Have Been Specially Curated To Provide Visitors Insight Into The Ways Of Life During The Kampung Days As Well As Into The Variety Of Floral And Faunal Species Found In Thomson Nature Park. The Ruins And Figs Trail Gives Visitors A Chance To Experience The Heritage Highlights Of The Hainan Village Through Carefully Conserved Ruins, While The Stream And Ferns Trail Enables Visitors To Appreciate The Freshwater Habitat In Thomson Nature Park And Observe The Great Diversity Of Ferns And Aquatic Animals Present.Specific Do’s And Don’ts:- No Pets Are Allowed- No Fishing- No Bicycles, Skates, Skateboards, Or Motorised Mobility Devicesplease Refer To The Map & Trail Etiquette Below For More Information."
103.8210277,1.357165891,Windsor Nature Park,"Located Off Venus Drive At The Upper Thomson Area, The 75-Hectare Windsor Nature Park Is A Green Buffer For The Central Catchment Nature Reserve.Visitors Can Explore New Trails Including The Specially Curated Hanguana Trail And The Drongo Trail. The Hanguana Trail Is Lined With Rare Native Plants, Some Of Which Are Named After Singapore. The Drongo Trail Features A Sub-Canopy Walk Where Visitors Can Catch A Glimpse Of The Fauna That Are Found Under The Canopy Level, In Addition To Examining The Understorey Of The Regenerating Secondary Forest.Discover Other Highlights Of Windsor Nature Park Such As A Marsh Habitat And Several Freshwater Streams By Hiking On The Restored Trails And New Boardwalks. Visitors Can Also Join Workshops To Learn About Singapore’s Natural Heritage And Ongoing Biodiversity Conservation Efforts At The Visitor Pavilion.Click Here To Find Out More.Specific Do’s And Don’ts:- No Pets Allowed Except On Venus Walk- No Fishing- No Bicyclesplease Refer To The Map & Trail Etiquette Below For More Information."
103.7794381,1.3768729,Chestnut Nature Park,"Chestnut Nature Park Is Located On The Eastern End Of Chestnut Avenue. Skirting The Central Catchment Nature Reserve, The Nature Park Serves As A Green Buffer For The Reserve.There Are Two Areas To Chestnut Nature Park – Chestnut Nature Park (South) And Chestnut Nature Park (North). Chestnut Nature Park (North) Is About 64 Hectares And Was Opened On 25 February 2017. Together With The Southern Portion Opened On April 2016, Chestnut Nature Park Now Totals 81 Hectares, Making It Singapore’s Largest Nature Park To Date.As Part Of The Ongoing Habitat Enhancement Programme To Augment Nparks’ Biodiversity Conservation Efforts, Chestnut Nature Park Has Been Planted Up With Native Tree Species. Examples Of These Native Tree Species Are The Braided Chestnut (Castanopsis Inermis), Singapore Walking-Stick Palm (Rhopaloblaste Singaporensis) And The Jelutong (Dyera Costulata).These Native Tree Species Will Allow Animals To Thrive By Improving The Ecological Connectivity Between Green Spaces So That Animals May Move Around Safely.As A Shared Community Space For Different Users, Visitors To Chestnut Nature Park Can Look Forward To A Range Of Recreational Activities Such As Hiking, Mountain Biking And Bird Watching. Chestnut Nature Park Is The First Nature Park In Singapore To Have Separate Mountain Biking And Hiking Trails.Visitors To Chestnut Nature Park Can Also Find Amenities Such As Shelters, Pavilions, Information Mapboards, Toilets, Hiking As Well As Mountain Biking Trails. Park Users Can Also Look Forward To A Kiosk Where They Can Rent And Wash Bikes As Well As Buy Pre-Packaged Snacks.Specific Do’s & Don’ts:- No Pets Are Allowed. Please Refer To Our Park Etiquette Below For More Information."
103.7819705,1.344746496,Rifle Range Nature Park,"Situated Along Rifle Range Road To The South Of Bukit Timah Nature Reserve, Rifle Range Nature Park Is 66 Hectares And Serves As A Green Buffer To Protect Bukit Timah Nature Reserve From Edge Effects And Abutting Developments. It Enhances Ecological Connectivity And Provides Complementary Habitats For The Nature Reserve’s Biodiversity.It Is Also Singapore’s First Net Positive Energy Nature Park, With The Energy Harvested From The Solar Panels Installed Around The Nature Park Exceeding The Expected Annual Operational Energy Consumption Of The Site.You Can Explore The Nature Park Via A Network Of Boardwalks And Trails. Highlights Include:Gliders Boardwalk (~411 M): A Barrier-Free Elevated Boardwalk Which Links The Visitor Pavilion To The Quarry Wetland, A Freshwater Ecosystem In The Heart Of The Nature Park Transformed From The Former Sin Seng Quarry. You Can View Animal Crossing Features Such As Rope Bridges And Colugo Poles From A Section Of The Boardwalk Which Is Above Rifle Range Road. They Have Been Implemented To Allow Wildlife Such As The Long-Tailed Macaque And Sunda Colugo To Cross Safely. Visit The Forest Exploration Trail To Learn More About These Features.Forest Exploration Trail (~113 M): In This Play Area, Logs And Boulders Create A Material Connection With Nature And Enable Children To Hone Their Balancing Skills As They Climb, Balance, Or Jump Over The Logs.Rambai Boardwalk (~535 M): Interpretive Signage Along The Boardwalk Allows You To Learn About Rifle Range Nature Park’s Rich History As The Site Of The Previous Singapore Gun Club And Sin Seng Quarry.Colugo Trail (~582 M): Hike Up Colugo Trail And Be Rewarded With A Panoramic View Of The Surroundings Atop Colugo Deck, Located 31 M Above The Quarry Wetland.Banyan (~647 M) And Gaharu Trail (~842 M): Visitors Looking For A More Rustic Hiking Experience Can Trek On The Banyan And Gaharu Trails, Which Begin At The Gaharu Entrance Of Rifle Range Nature Park On Jalan Kampong Chantek. Visitors Can Hike Beneath The Grove Of Banyan Trees And Stop To Admire A Tranquil Stream Along The Banyan Trail.Quarry Wetland: Transformed From The Former Sin Seng Quarry, The Wetland Makes Full Use Of The Existing Terrain And Provides Habitats For Wetland Animals Like The Scarlet Skimmer (Orthetrum Testaceum), Common Kingfisher (Alcedo Atthis) And Even Migratory Birds.Colugo Deck: The Design Of The Colugo Deck Is Inspired By How The Sunda Colugo (Galeopterus Variegatus) Looks Like When In Flight.Waterhen Hide: Visitors Can Get Up Close To The Quarry Wetland And Observe Wetland Birds Such As The Yellow Bittern (Ixobrychus Sinensis) And Five Species Of Kingfishers.You Can Enter The Nature Park Via 6 Entrances Found Along Rifle Range Road, Upper Bukit Timah Road, Hindhede Drive, Jalan Kampong Chantek And The Rail Corridor.Click Herefor A Detailed Map Of The Park."
103.8265945,1.369015771,Lower Peirce Reservoir Park,"The Lower Peirce Reservoir, Singapore'S Second-Oldest Reservoir, Was Built By Impounding The Upper Reaches Of The Kallang River And Was Commissioned In 1912. The Forest That Lines Its Banks Is Considered A Mature Secondary Rainforest And Is Still Dotted With Numerous Rubber Trees And Oil Palms – Visible Reminders Of A Past When Vast Areas Of Singapore Were Covered With Plantations.Visit The Lower Peirce Trail Running Through The Forest And Along The Edge Of This Reservoir. Along This Charming 900-Metre Boardwalk, You’ll Be Greeted With Captivating Views Of Regenerating Secondary Forests That Line The Reservoir As Well As A Variety Of Flora And Fauna.The Lower Peirce Reservoir, Formerly Known As The Kallang River Reservoir, Is Singapore'S Second Reservoir And Was Planned As An Extension Of The First Reservoir (Macritchie Reservoir) To Meet The Increasing Demand For The Supply Of Water In Singapore. The Municipal Commission Proposed Its Construction In July 1902 And The Westminster Construction Company Of London Was Awarded The Contract In March 1907. The Reservoir Was Completed In 1910, At A Cost Of 967,641 Straits Dollars, By Damming The Upper Reaches Of The Kallang River And Was Officially Opened On 26 March 1912. Ten Years Later, The Reservoir Was Renamed The Peirce Reservoir In Recognition Of Robert Peirce, Who Was The Municipal Engineer Of Singapore From 1901 To 1916. It Only Acquired Its Current Name In 1975, After The Upper Peirce Reservoir Was Built.Help Protect This Precious Patch Of Forest And Its Inhabitants By Staying On The Boardwalks. Straying Off The Boardwalks Will Not Only Disturb The Native Flora And Fauna But Also Degrade And Eventually Fragment The Sensitive Habitat. On Your Journey Of Discovery, Remember Some Simple Tips To Help Make Park Visits Enjoyable For Everyone.Specific Do’s & Don’ts:1. No Pets Allowed In The Nature Reserve.2. No Feeding Of Monkeys And Other Wild Animals.Click Here To Find Out More About Our Trail Etiquette."
103.7782715,1.368024607,Zhenghua Nature Park,"Zhenghua Nature Park Is Located In Bukit Panjang.Skirting The Central Catchment Nature Reserve, The Nature Park Serves As A Green Buffer For The Reserve.The 13.5 Hectare Linear Zhenghua Nature Park Was Completed In 2002 And Stretches For About 2.5 Km Along The Bke, Linking The Bukit Panjang Park Connector To Bukit Timah Nature Reserve. A 3.8 Hectare Extension Was Opened In November 2015, Bringing The Total Area Of Zhenghua Nature Park To 17.3 Hectares.The Nature Park Is Part Of Our Holistic Approach To Strengthen The Conservation Of The Biodiversity Of Our Nature Reserves. By Forming A Vital Ecological Linkage Between Nature Reserves And Forested Areas In The West Like The Western Catchment, It Facilitates The Safe Passage Of Fauna Among Green Spaces. Such Buffers Thus Function As Extensions Of The Reserve.A Wide Variety Of Plants Was Introduced To The Extension To Provide More Opportunities For The Community To Appreciate Biodiversity. As Part Of Habitat Enhancement Efforts, Certain Native Plant Species Have Been Incorporated To Provide Ecological Services To The Surrounding Fauna. Among These Were Bird And Butterfly-Attracting Plants Such As The Tembusu And Jejawi.As A Result Of Its Linkage To The Nature Reserve And Its Diverse Species Of Plants, High Biodiversity Can Be Observed In The Park. 37 Bird Species Which Have Been Spotted At The Park Include The Olive-Backed Sunbird, Flameback Woodpecker, Pink-Necked Green Pigeon, Greater Racket-Tailed Drongo And Long-Tailed Parakeet. Long-Tailed Macaques, Squirrels, Monitor Lizards And Many Others Are A Common Sight In The Park.Facilities In The Park Include A Multi-Purpose Event Lawn, A Children’s Play Area, An Exercise Station, A Pavilion, Public Toilets, Shelters, As Well As Jogging And Cycling Tracks.Specific Do'S And Don'Ts- Dogs Are To Be Leashed And Poo To Be Picked Up.Please Refer To Our Trail Etiquette Below For More Information."
103.7557269,1.35757853,Bukit Batok Town Park,"Also Known As Little Guilin Or Xiao Guilin Among The Locals, Bukit Batok Town Park Looks Similar To That Of Guilin In China - A Granite Rock Sitting Within A Lake.Two Dome Shaped Shelters Give You A Fantastic View Of The Tranquil Lake. The Towering Rock Cliffs Make A Majestic Backdrop To The Large Lake.The Park Is Beautifully Landscaped So That You Can Walk Along The Banks Of The Lake. This Park Is Popular With Shutterbugs And Wedding Couples.Specific Dos And Don’ts:Fishing Is Not Allowed In The Park."
103.7641971,1.350140107,Bukit Batok Nature Park,"Developed On An Abandoned Quarry Site In 1988, Bukit Batok Nature Park Features Stunning Views And Crystal Clear Waters. Serene And Tranquil, It Is An Ideal Place For A Peaceful Nature Walk.Take A Leisurely Stroll On The Meandering Footpaths That Run Through The Secondary Forest And Admire The Beauty Of The Lush Greenery. Alternatively, Go For A Run On The Park’s Undulating Terrain For An Invigorating Workout Or Hike Through The Forest And Enjoy The Serene Ambience Of The Surroundings.Climb The Look-Out Points That Reach More Than 10 Storeys High For Stunning Views Of The Quarry. Don’t Forget To Stop By The Park’s Entrance To Marvel At The Picturesque Pond That Lies At The Foot Of A High Cliff Wall. The Pond Runs Deep And Still – A Relic From The Mining Days Of The Region. Pay Tribute To The Soldiers And Victims Of World War Ii At The Memorial Plaque Situated Within The Park.  During World War Ii, The Japanese Selected The Lorong Sesuai Site As A Memorial For The Soldiers Who Died. All That Remains Are Two Pillars And 120 Concrete Steps Leading Up To A Transmission Tower. Read About The Significance And Meaning Of The Location On The Memorial Plaque That Lies At The Foot Of The Stairs.Specific Dos And Don’ts:Fishing Is Not Allowed In The Park. Please Refer To Our Park Etiquette Below For More Information."
103.8039298,1.263831851,Labrador Nature Park,No Description Found For Labrador Nature Park
103.8082067,1.265050538,Bukit Chermin Boardwalk,No Description Found For Bukit Chermin Boardwalk
103.8201254,1.401902555,SpringLeaf Nature Park,"Springleaf Nature Park Was Formerly Part Of The Chan Chu Kang Village – Named After The Headman Chan Ah Lak Who Acquired The Land Near Seletar River To Cultivate Gambier And Pepper. The Village Was Located In The 'Kangkar' Of The River, Meaning The Land Around The Riverbank In Teochew. There Were Over 10 Other Villages In The Surrounding Area, Including Kampong Telok Soo, Kampong Jalan Kula Simpang And Sembawang Village.The Forests Near Chan Chu Kang Were Also Favoured For The Collection Of Botanical And Zoological Specimens. Prominent Collectors, Including Henry Nicholas Ridley (The First Director Of The Singapore Botanic Gardens) Made The First Collections Of Native Plant Species From The Area. Plant Specimens Collected By Ridley Include Thekopsia Singapurensis,Bhesa Paniculataandneesia Malayana. These Specimens Were Stored In The Singapore Botanic Gardens Herbarium, And Can Still Be Found There Today.With Urbanisation, The Chan Chu Kang Village And Nearby Plantations Were Left To Rest And Became Nature Corridors Between The Central Catchment Nature Reserve And Surrounding Green Spaces. In Addition To Its Rich History, Springleaf Nature Park Is An Area Of High Biodiversity.On Your Journey Of Discovery, Remember Some Simple Tips To Help Make Park Visits Enjoyable For Everyone.Click Hereto Find Out More."
103.8018923,1.37632686,Central Catchment Nature Reserve,"Acting As A Large Green Lung Situated Right In The Centre Of Singapore Is The Central Catchment Nature Reserve. The Largest Of The Nature Reserves In Singapore, The Central Catchment Nature Reserve Occupies Over 2,000 Hectares Of Forest Cover And Is Home To Some Of The Richest Forests In Terms Of Biodiversity.Dipterocarp Forests, Which Are Species-Rich Primary Lowland Forests, Were Once Abundant In Singapore Before Human Settlements Developed. Today, Less Than 0.5% Of The Original Primary Forest Cover Remains And It Can Only Be Found In Small Patches Within The Central Catchment Nature Reserve And The Bukit Timah Nature Reserve. An Even Rarer Forest Type In Singapore Is The Primary Freshwater Swamp Forest, With The Most Significant Remaining Patch Being The Nee Soon Swamp Forest In The Central Catchment Nature Reserve.The Existing Habitats Are Home To A Magnificent Diversity Of Plants. Examples Include The Keruing (Dipterocarpusspp.) And Meranti (Shoreaspp.) As Well As The Critically Endangered Raffles Banded Langur (Presbytis Femoralis) And The Sunda Pangolin (Manis Javanica).Come And Experience Their Beauty On The Carefully Planned Nature Trails. The Macritchie Trails Are A 20-Kilometre Network Of Trails And Boardwalks Winding Through The Forest Around The Macritchie Reservoir. Key Attractions Of The Central Catchment Nature Reserve Include The Treetop Walk, A 250-Metre Suspension Bridge That Connects The Two Highest Points In Macritchie And The Jelutong Tower, A 7-Deck Observation Tower That Allows Visitors An Unimpeded Overview Of The Forest In Macritchie.The Central Catchment Nature Reserve And The Bukit Timah Nature Reserve Once Formed A Contiguous Forest. That All Changed When The Bukit Timah Expressway (Bke) Was Constructed In 1986, Separating The Nature Reserves Into Two Fragments. The Eco-Link@Bke, Completed In 2013, Now Connects The Two Reserves Once Again To Facilitate Animal Movements And The Dispersal Of Forest Plant Seeds.Macritchie Reservoir Park Is Located At The Southern-Eastern End Of The Central Catchment Nature Reserve, And Is Highly Visited By Nature Lovers And Sports Enthusiasts. It Serves As A Gateway To Singapore’s Nature Reserves, Being A Popular Starting Point For Visitors Who Wish To Hike The Macritchie Trails. For More Information On Macritchie Reservoir Park, Visit Pub’s Websitehere.Abutting The Central Catchment Nature Reservelornie Nature Corridorstrengthens The Ecological Resilience Of The Reserve By Protecting The Forest Edge Against The Impacts Of Drying And Wind. This Buffer Also Makes The Nature Reserve More Resilient To The Effects Of Climate Change Such As Extreme Weather Conditions."
103.9880029,1.404152777,Pulau Sekudu,No Description Found For Pulau Sekudu
104.053771,1.433011313,Pulau Unum,No Description Found For Pulau Unum
104.0476072,1.436663721,Beting Bronok,No Description Found For Beting Bronok
103.7735553,1.362638478,Dairy Farm Nature Park,"Set In A Rustic Environment With Multiple Trails For Hiking And Biking, The 75-Hectare Dairy Farm Nature Park Offers A Host Of Recreational Activities And Amenities Such As A Nature Trail And Former Quarry. The Parkis Known For The Wallace Education Centre Which Features A Permanent Exhibition On The Renowned English Naturalist Alfred Russel Wallace To Honour His Contributions To Natural Science. Arriving On 18 April 1854, Wallace Used Singapore As A Base To Study The Natural History Of The Malay Archipelago For Eight Years. A Contemporary Of Charles Darwin, Wallace Is The Other “father” Behind The Theory Of Evolution.Wallace Education Centreformerly A Cow Shed, The Wallace Education Centre Now Houses An Education Gallery Where Visitors Can Learn About The Biogeography And Biodiversity Of Our Region. Visitors Of All Ages Will Enjoy Learning About Insects And Other Resident Wildlife In Dairy Farm Through The Various Interactive Exhibits. Highlights Include Exploring The Natural World With Magnifying Glasses In The Citizen Science Lab, 3D Models Of Biodiversity Found In The Area And A Trick-Eye Wall. Themed Exhibitions Are Also Regularly Held In The Gallery. As It No Longer Functions As A Dairy Farm, There Are No Real Cows At Dairy Farm Nature Park.Wallace Trailconstructed In 2009 And Subsequently Extended In 2020, The Wallace Trail Is A 2.2 Km Nature Trail Dedicated To Alfred Russel Wallace That Stretches From Hillview Mrt Station To The Wallace Education Centre. In 1854, Wallace Stopped Over In Singapore During His Journey To The Malay Archipelago, And Collected Many Species Of Beetles In The Vicinity Of The Dairy Farm Site.On This Trail, Discover The Flora And Fauna Of Dairy Farm Nature Park Through Wallace’s Eyes While Simultaneously Learning About The History Of The Area Through Artefacts From The Past. Don’t Forget To Check Out The Unobstructed View Of The Surrounding Secondary Forest From The New Viewing Deck.Community Nurserysingapore’s First Community Nursery Has Just Been Set Up At Dairy Farm Nature Park. Volunteers Will Propagate And Nurture Endangered Native Plants From Seeds Or Wildlings Collected From The Nearby Forests Of Bukit Timah And Central Catchment Nature Reserve. The Plants Will Contribute To Nparks' Efforts Such As Theone Million Trees Movement. If You Are Interested In Volunteering, You May Sign Up As A Central Nature Reserve Volunteerhere.Specific Do’s & Don’ts:1. No Pets Allowed In The Nature Park. Dogs On Leashes Are Only Allowed On The Tarmac Road Only And Not Nature Trails.2. No Feeding Of Monkeys And Other Wild Animals. Please Refer To Our Trail Etiquette Below For More Information."
103.7245201,1.446380242,Sungei Buloh Wetland Reserve,"Advisory:Some Areas Of The Wetland Reserve May Be Temporarily Closed In February 2023 For Safety Reasons Due To Flooding Caused By High Tides And Bad Weather. Do Not Enter The Areas That Are Temporarily Closed. Please Refer To Thenoticefor More Information.Discover The Beauty And Wonders Of Nature At Singapore’s First Asean Heritage Park. Uncover A World Filled With Rich Biodiversity As You Wander Through The Wetlands With An Extensive Mangrove Forest Of Sungei Buloh Wetland Reserve.Sungei Buloh Was First Opened As A Nature Park In 1993. In 2002, 130 Hectares Were Officially Gazetted As A Nature Reserve And Renamed Sungei Buloh Wetland Reserve To Better Reflect Its Status. In The Same Year, It Was Recognised As A Site Of International Importance For Migratory Birds And Awarded A Certificate By Wetlands International, Marking The Reserve'S Formal Entry Into The East Asian Australasian Shorebird Site Network, Which Includes Australia'S Kakadu National Park, China'S Mai Po – Inner Deep Bay And Japan'S Yatsu Tidal Flats. And In 2003, Sungei Buloh Wetland Reserve Became Singapore'S First Asean Heritage Park.Since Then Sungei Buloh Has Expanded To Include 202Ha Of Mangroves, Mudflats, Ponds And Forests, Providing An Even Larger Sanctuary For The Flora And Fauna That Call It Home. This Includes The Newest Extension That Houses A Brand New Visitor Centre And New Trails For Visitors To Explore And Enjoy. This New Extension Is Situated Along Kranji Way, And Is Easily Accessible By Public Transport, Bringing Sungei Buloh Even Closer To The Public.Throughout The Year:Trek Through This Ecological Jewel’s Many Trails And Discover Its Native Inhabitants Such As Mudskippers, Crabs, Shellfish, Water Snakes, Birds, Spiders, Monitor Lizards And Otters. Admire The Beauty Of Resident Birds Such As Herons, Kingfishers And Sunbirds.Seasonal From September To March:During The Migratory Season, Catch Sight Of The Diverse Flocks Of Shorebirds Or Waders Including Plovers And Sandpipers.Map Of Walking Trailsanimal Encounterssungei Buloh Is Home To A Rich Diversity Of Native Wildlife. What Should You Do If You Encounter Them?Clickhereto Find Out More.Catch A Glimpse Of The Wildlife Found In Sungei Buloh Throughthese Videos.Sungei Buloh Nature Park Networksungei Buloh Wetland Reserve And Kranji Coastal Nature Park (Former Eastern Extension) Is Part Of Thesungei Buloh Nature Park Network.
To Explore Other Areas Under The Network, Visit:Kranji Marsheskranji Reservoir Park"
103.7357639,1.441504017,Kranji Coastal Nature Park,No Description Found For Kranji Coastal Nature Park
103.7377365,1.439529658,Kranji Reservoir Park B,No Description Found For Kranji Reservoir Park B
103.7292559,1.41911053,Kranji Marshes,"Be Charmed By The Rustic Nature Of Kranji Marshes, A 56.8-Hectare Freshwater Marshland That Is Home To Unique Biodiversity. Located Along The Northwestern Shore Of Kranji Reservoir, It Is One Of The Largest Freshwater Marshes In Singapore.Kranji Marshes Is Home To A Rich Array Of Flora And Fauna, Including More Than 170 Species Of Birds, 54 Species Of Butterflies And 33 Species Of Dragonflies. Together With Sungei Buloh Wetland Reserve, It Provides An Important Habitat In The Kranji Area For The Conservation Of Biodiversity, Especially Marsh Birds.With A Range Of Natural Habitats Such As Freshwater Marsh, Woodland And Grass Habitats, Kranji Marshes Is A Great Place For Visitors To Observe And Enjoy Nature.Throughout The Year:Walk Along Neo Tiew Woods And Look Out For Birds And Reptiles, Such As Woodpeckers And Monitor Lizards. Often, A Changeable Hawk Eagle Or White-Bellied Sea Eagle Can Be Seen Perching On One Of The Tall Trees. At The Marsh Station, Visit One Of The Bird Hides For A Chance To Observe Shy Marsh Birds Such As The Purple Swamphen And Common Moorhen. Enjoy A Panoramic View Of Kranji Marshes And Kranji Reservoir From The Top Of Raptor Tower.Seasonal From November To March:During The Raptor Migratory Season, Look Out For Visiting Species Such As The Black Baza And Japanese Sparrowhawk From The Top Of Raptor Tower.Map:Core Conservation Area:The Core Conservation Area Is An Ecologically Sensitive Habitat And Is Closed To The Public, Except For Activities Approved By Nparks.Sungei Buloh Nature Park Networkkranji Marshes Is Part Of Thesungei Buloh Nature Park Network.To Explore Other Areas Under The Network, Visit:Sungei Buloh Wetland Reservekranji Reservoir Park"
103.7205689,1.435828482,Sungei Buloh Southern Extension,No Description Found For Sungei Buloh Southern Extension
103.7426551,1.438353064,Kranji Reservoir Park A,No Description Found For Kranji Reservoir Park A
103.8039266,1.268952907,Berlayer Creek,"Berlayer Creek Is Part Of The Labrador Nature And Coastal Walk. It Is Part Of A Larger Network Of Habitats Snaking Through The Southern Ridges To The Waterfront.Currently One Of Two Remaining Mangroves Located In The South Of Mainland Singapore, The 5.61-Hectare Berlayer Creek Comprises Three Types Of Habitats Including – Mangroves, Rocky Shore And Mudflats And Is Home To A Diverse Group Of Fauna And Flora."
103.9596241,1.408681482,Pulau Ubin and Chek Jawa,"Be Transported Back In Time To 1960S Singapore As You Embark On A Trip To Pulau Ubin. Shaped Like A Boomerang, This 1,020-Hectare Island Is Home To Singapore’s Last Village Or Kampongs, As Well As The Chek Jawa Wetlands, One Of Singapore’s Richest Ecosystems.Visit Thepulau Ubin Micrositeto Learn More About The Island’s Rich Natural And Cultural Heritage, Or Check Outcelebrating Ubin – Calendar Of Activities."
